{
  "$schema": "https://json-schema.org/draft/2020-12/schema",
  "title": "MarkZ design tokens",
  "type": "object",
  "additionalProperties": false,
  "required": [
    "version",
    "brand",
    "theme",
    "fixedColors",
    "shape",
    "spacing",
    "typeScale",
    "layout",
    "breakpoints",
    "interaction",
    "accessibility",
    "motion"
  ],
  "properties": {
    "$schema": { "type": "string" },
    "version": { "type": "string", "pattern": "^[0-9]+\\.[0-9]+\\.[0-9]+$" },
    "brand": {
      "type": "object",
      "additionalProperties": false,
      "required": [
        "name",
        "wordmark",
        "tagline",
        "description",
        "domain",
        "assetRevision",
        "wordmarkFont",
        "wordmarkWeight",
        "dotScale"
      ],
      "properties": {
        "name": { "const": "MarkZ" },
        "wordmark": { "const": "MarkZ." },
        "tagline": { "type": "string", "minLength": 1 },
        "description": { "type": "string", "minLength": 1 },
        "domain": { "const": "markz.fun" },
        "assetRevision": { "type": "string", "pattern": "^v[0-9]+$" },
        "wordmarkFont": { "type": "string", "minLength": 1 },
        "wordmarkWeight": { "type": "integer", "minimum": 600, "maximum": 900 },
        "dotScale": { "type": "number", "minimum": 0.15, "maximum": 0.35 }
      }
    },
    "theme": {
      "type": "object",
      "required": ["fontOrigin", "cdnCaching", "typography", "colors"]
    },
    "fixedColors": {
      "type": "object",
      "required": ["brandSurface", "brandInk", "brandMuted", "brandAccent", "brandLine"]
    },
    "shape": {
      "type": "object",
      "required": ["controlRadius", "imageRadius", "focusRadius"]
    },
    "spacing": {
      "type": "object",
      "additionalProperties": { "type": "string" },
      "required": ["1", "2", "3", "4", "5", "6", "8", "10", "12", "16", "20"]
    },
    "typeScale": {
      "type": "object",
      "required": [
        "display",
        "displayCompact",
        "headline",
        "headlineCompact",
        "title",
        "body",
        "label"
      ],
      "additionalProperties": {
        "type": "object",
        "required": ["fontSize", "lineHeight", "weight"]
      }
    },
    "layout": {
      "type": "object",
      "required": ["shellMax", "articleMax", "homeMax", "archiveMax", "readingMeasure"]
    },
    "breakpoints": {
      "type": "object",
      "required": ["compact", "wide"]
    },
    "interaction": {
      "type": "object",
      "required": ["targetMinimum", "targetComfortable", "focusWidth", "focusOffset"]
    },
    "accessibility": {
      "type": "object",
      "additionalProperties": false,
      "required": ["textContrast", "largeTextContrast", "nonTextContrast"],
      "properties": {
        "textContrast": { "type": "number", "minimum": 4.5 },
        "largeTextContrast": { "type": "number", "minimum": 3 },
        "nonTextContrast": { "type": "number", "minimum": 3 }
      }
    },
    "motion": {
      "type": "object",
      "required": ["fast", "easing"]
    }
  }
}
